{"canonical_writes":0,"causal_identification":"not_applicable","created_utc":"2026-07-28T00:00:00Z","engine_receipt_id":"sha256:5883ff204dc2c5f9a5168106703b5c6da11476e5130907e8efa87de46acf1b73","formal_certificate_ref":{"digest":"sha256:dddddddddddddddddddddddddddddddddddddddddddddddddddddddddddddddd","media_type":"application/vnd.srlab.formal-certificate+json","schema_version":"ArtifactRef/v1","size_bytes":512},"formal_check":"proven","grants_authority":false,"receipt_id":"sha256:8d9ee3dac8c31e2b73477eaee385074aaf8fab780ec8a6b08b1131e59f5c2b89","schema_version":"ScienceLabValidationReceipt/v1","scientific_check":"checked","statistical_support":"none","validator_id":"validator-omega"}
